Nome,Região,Descrição
Canal mais visitado,Kiel (Alemanha),"O Canal de Kiel, na Alemanha, é um dos canais artificiais mais movimentados do mundo. Ele recebe mais de 30 mil embarcações por ano."
Maior ave viva,Ávestruz na África,"A maior ave viva é o avestruz, nativo da África. Ele pode atingir até 2,7 metros de altura e pesar mais de 150 kg."
Alcatraz,Mar dos EUA,"Alcatraz é uma ilha localizada na Baía de São Francisco, nos Estados Unidos. Ficou famosa por abrigar uma prisão federal entre 1934 e 1963."
Primeiros Jogos Olímpicos Modernos,1896 e 0 mulheres,"Os primeiros Jogos Olímpicos Modernos ocorreram em 1896, em Atenas. Participaram cerca de 241 atletas, todos homens."
Maior recife de coral,Austrália,"O maior recife de coral do mundo é a Grande Barreira de Corais, na Austrália. Ela possui cerca de 2.300 km de extensão."
Tomate,Astecas e Incas,"O tomate foi domesticado por povos mesoamericanos, como astecas e incas. Seu cultivo ocorreu entre 500 a.C. e 700 d.C."
Kilimanjaro,Tanzânia,"O Monte Kilimanjaro, na Tanzânia, tem 5.895 metros de altitude. É a montanha mais alta da África."
Ilha de Jeju,Coreia do Sul,"A Ilha de Jeju, na Coreia do Sul, possui origem vulcânica. Sua área é de aproximadamente 1.850 km²."
País com mais parques nacionais,Austrália,A Austrália é o país com maior número de parques nacionais. São mais de 600 áreas protegidas oficialmente.
Xadrez,Pérsia,O xadrez teve origem na Pérsia por volta do século VI. O jogo era chamado de “shatranj”.
Corrente do Golfo,Mares e oceanos do norte,A Corrente do Golfo é uma corrente oceânica quente que atravessa o Atlântico Norte. Ela transporta cerca de 30 milhões de m³ de água por segundo.
Forte Vermelho,Índia,"O Forte Vermelho, na Índia, foi construído em 1648 durante o Império Mogol. Ele possui muralhas com até 33 metros de altura."
Povos esquimós,Norte do Globo,"Os povos esquimós habitam regiões do extremo norte do globo. Eles vivem em áreas do Alasca, Canadá, Groenlândia e Sibéria."
Palácio de Inverno,Rússia,"O Palácio de Inverno, na Rússia, foi concluído em 1764. Ele possui mais de 1.000 cômodos."
Ilha de Santa Helena,Atlântico Sul e Mediterrâneo,"A Ilha de Santa Helena está localizada no Atlântico Sul, a cerca de 1.950 km da África. Ela é conhecida por ter sido o local de exílio de Napoleão Bonaparte."
Mar Morto,"Israel, Palestina e Jordânia","O Mar Morto faz fronteira com Israel, Palestina e Jordânia. Ele está a cerca de 430 metros abaixo do nível do mar."
Kiwi(animal),Nova Zelândia,O kiwi é uma ave não voadora endêmica da Nova Zelândia. Ele pode pesar até 3 kg e tornou-se símbolo nacional do país.
Serengueti,Tanzânia,"O Parque Nacional do Serengueti, na Tanzânia, possui cerca de 14.750 km². É famoso pela migração anual de mais de 1,5 milhão de gnus."
Maior base espacial,Cazaquistão,"A maior base espacial do mundo é Baikonur, no Cazaquistão. Ela foi inaugurada em 1955 e ainda é usada para lançamentos russos."
Odisseia,"Turquia, Itália e Egito","A Odisseia, atribuída a Homero, descreve viagens pelo Mediterrâneo oriental. Os locais citados correspondem a regiões da atual Turquia, Itália e Egito."
Svalvard,Oceano Ártico,"Svalbard é um arquipélago localizado no Oceano Ártico, pertencente à Noruega. Fica a apenas 1.000 km do Polo Norte."
Língua mais falada,Mandarim,O mandarim é a língua mais falada do mundo em número de falantes nativos. São mais de 900 milhões de pessoas.
Gingko,China,O ginkgo biloba é originário da China e existe há mais de 200 milhões de anos. É considerado um “fóssil vivo”.
Ilha de Páscoa,Oceano Pacífico,"A Ilha de Páscoa está no Oceano Pacífico, a cerca de 3.700 km do Chile. É conhecida por seus cerca de 900 moais."
Maior mar mediterrâneao,Indonésia,"O maior mar mediterrâneo do mundo é o Mar de Banda, na Indonésia. Ele é cercado por ilhas e atinge profundidades superiores a 7.000 metros."
Basílica da Nossa Senhora da Paz,Costa do Marfim,"A Basílica de Nossa Senhora da Paz, na Costa do Marfim, foi inaugurada em 1989. Ela é maior que a Basílica de São Pedro, no Vaticano."
Fim do Reino Vândalo,Norte da África e Mediterrâneo,O Reino Vândalo foi derrotado em 534 d.C. após a invasão bizantina liderada por Belisário no Norte da África.
Rali Dakar 2014,América do Sul ,"O Rali Dakar de 2014 ocorreu na América do Sul. O percurso passou por Argentina, Bolívia e Chile."
Terra de Francisco José,Ártico,A Terra de Francisco José é um arquipélago russo no Oceano Ártico. Mais de 85% de sua área é coberta por gelo.
Lugar onde mais chove,Índia,"O lugar onde mais chove no mundo é Mawsynram, na Índia. A média anual ultrapassa 11.800 mm de precipitação."
Estrada nacional mais longa,Austrália,"A Estrada Nacional 1 da Austrália é a mais longa do país, com cerca de 14.500 km. Ela circunda todo o continente."
Maior ave de rapina,Himalaia,A maior ave de rapina viva é o abutre-do-himalaia. Sua envergadura pode ultrapassar 3 metros.
Maior zona úmida,Pantanal,O Pantanal é a maior zona úmida continental do planeta. Sua área chega a aproximadamente 150 mil km².
Maior Geleira,Polo Sul,"A maior geleira do mundo é a Geleira Lambert, na Antártida. Ela possui cerca de 100 km de largura e 400 km de extensão."
Ponte Carlos,República Tcheca,"A Ponte Carlos, em Praga, foi concluída em 1402. Ela possui 516 metros de comprimento e 16 arcos."
Catarata mais larga,Laos,"A catarata mais larga do mundo é Khone Phapheng, no Laos. Durante cheias, pode ultrapassar 10 km de largura."
Afluente mais comprido,Cazaquistão e Rússia,"O maior afluente em extensão é o rio Irtysh, que atravessa Cazaquistão e Rússia. Ele possui cerca de 4.248 km."
Maior parque eólico marinho,Mar do Norte,"O maior parque eólico marinho do mundo está no Mar do Norte. O complexo Hornsea ultrapassa 1,3 GW de capacidade instalada."
Djenné,Alta Guiné,"Djenné, na região da Alta Guiné, abriga a maior construção de adobe do mundo. Sua Grande Mesquita foi reconstruída em 1907."
Maior palácio,China,"O maior palácio do mundo é a Cidade Proibida, na China. Ela possui cerca de 720 mil m² e mais de 8.700 cômodos."
Capivara,América do Sul ,A capivara é o maior roedor vivo do planeta. Pode pesar até 65 kg e é nativa da América do Sul.
Segunda maior ilha,Melanésia,"A segunda maior ilha do mundo é a Nova Guiné, na Melanésia. Sua área é de aproximadamente 785 mil km²."
Batata,Império Inca,A batata foi domesticada pelo Império Inca há cerca de 8.000 anos. Existem hoje mais de 4.000 variedades.
Minarete(Torre ao lado de uma Mesquita) mais alto,Marrocos,"O minarete mais alto do mundo é o da Mesquita Hassan II, no Marrocos. Ele mede cerca de 210 metros."
Caaba,Arábia Saudita,"A Caaba, em Meca, é o local mais sagrado do Islã. A estrutura atual mede cerca de 13 metros de altura."
Terremoto de maior intensidade,Chile,"O terremoto de maior intensidade já registrado ocorreu no Chile em 1960. Ele atingiu magnitude 9,5."
Maior densidade de bilionários,Nova York,Nova York possui a maior concentração de bilionários do mundo. São mais de 110 residentes com patrimônio bilionário.
Valáquia,Sul da Europa,A Valáquia é uma região histórica situada no sul da Europa Oriental. Hoje faz parte da Romênia.
Múmia mais antiga encontrada,Itália,A múmia humana mais antiga conhecida foi encontrada nos Alpes italianos. Ötzi tem cerca de 5.300 anos.
País com maior área,Rússia,"A Rússia é o país com maior área territorial do mundo. Ela possui aproximadamente 17,1 milhões de km²."